Project,AI summary,Blocked by,Blocking,Eng hours,Priority,Progress,Project type,Status,Tasks,Timeline
DevOps,No content,,,350,P0,0,Improve customer support,Done,"Documentation des scripts d’automatisation pour le provisionnement (Terraform, Ansible). (Projet%20ganzou%2017c94c02d31e80c09164c36db48f4704/Tasks%2017c94c02d31e81ac96e3f2c7502015ad/Documentation%20des%20scripts%20d%E2%80%99automatisation%20pour%20le%202f042d4d7f1244b4a8c0d01fac99c0fc.html), Untitled (https://www.notion.so/17c94c02d31e80d59438e5bca11e0d42?pvs=21), Mise en place des pipelines CI/CD pour l’automatisation des déploiements (Jenkins, GitLab CI). (Projet%20ganzou%2017c94c02d31e80c09164c36db48f4704/Tasks%2017c94c02d31e81ac96e3f2c7502015ad/Mise%20en%20place%20des%20pipelines%20CI%20CD%20pour%20l%E2%80%99automatis%205ed3ca6d0f8f498db40ba44a8a498d21.html), Utilisation de Terraform pour gérer les environnements cloud, justification des choix et architecture associée. (Projet%20ganzou%2017c94c02d31e80c09164c36db48f4704/Tasks%2017c94c02d31e81ac96e3f2c7502015ad/Utilisation%20de%20Terraform%20pour%20ge%CC%81rer%20les%20environne%20a0e5034e1ffe49cfb476f240301186c8.html), Documentation détaillée des fichiers de configuration, gestion des versions des infrastructures. (Projet%20ganzou%2017c94c02d31e80c09164c36db48f4704/Tasks%2017c94c02d31e81ac96e3f2c7502015ad/Documentation%20de%CC%81taille%CC%81e%20des%20fichiers%20de%20configur%2013094806a0b9497389997b4e1a908bfd.html), Mise en place de DevSecOps : gestion des vulnérabilités dans les pipelines CI/CD. (Projet%20ganzou%2017c94c02d31e80c09164c36db48f4704/Tasks%2017c94c02d31e81ac96e3f2c7502015ad/Mise%20en%20place%20de%20DevSecOps%20gestion%20des%20vulne%CC%81rabil%204d81ec8f95bd42829aff09ac8989d388.html), Plan de tests automatisés pour chaque étape du pipeline : tests unitaires, d'intégration, de performance. (Projet%20ganzou%2017c94c02d31e80c09164c36db48f4704/Tasks%2017c94c02d31e81ac96e3f2c7502015ad/Plan%20de%20tests%20automatise%CC%81s%20pour%20chaque%20e%CC%81tape%20du%20p%2069130275fb174879a4860e142b1516fa.html), Documentation des erreurs et des correctifs pour améliorer les pipelines. (Projet%20ganzou%2017c94c02d31e80c09164c36db48f4704/Tasks%2017c94c02d31e81ac96e3f2c7502015ad/Documentation%20des%20erreurs%20et%20des%20correctifs%20pour%20a%20276b38972f7a4581b5013819f8083466.html), Monitoring et gestion des alertes	Utilisation d'outils de monitoring (Prometheus, Grafana) pour surveiller l’état des pipelines CI/CD. (Projet%20ganzou%2017c94c02d31e80c09164c36db48f4704/Tasks%2017c94c02d31e81ac96e3f2c7502015ad/Monitoring%20et%20gestion%20des%20alertes%20Utilisation%20d'ou%20aa33a8222f644d59a4d0ae0159aeba19.html), Documentation des politiques de gestion des alertes en cas de dépassement des seuils de performance. (Projet%20ganzou%2017c94c02d31e80c09164c36db48f4704/Tasks%2017c94c02d31e81ac96e3f2c7502015ad/Documentation%20des%20politiques%20de%20gestion%20des%20alerte%20a8cd6e79b7d046f6ac31353c5cac898b.html), Stratégie d’orchestration et de déploiement de conteneurs (Kubernetes, Docker). (Projet%20ganzou%2017c94c02d31e80c09164c36db48f4704/Tasks%2017c94c02d31e81ac96e3f2c7502015ad/Strate%CC%81gie%20d%E2%80%99orchestration%20et%20de%20de%CC%81ploiement%20de%20c%20c07983d4606f4247be194058dd294fc9.html)","February 14, 2025 → May 16, 2025"
Réseaux et sécurité,No content,,,200,P1,0.9230769230769231,Improve customer support,In progress,"Schéma détaillé du réseau (LAN, WAN, VLANs) avec segmentation pour les différentes parties prenantes. (Projet%20ganzou%2017c94c02d31e80c09164c36db48f4704/Tasks%2017c94c02d31e81ac96e3f2c7502015ad/Sche%CC%81ma%20de%CC%81taille%CC%81%20du%20re%CC%81seau%20(LAN,%20WAN,%20VLANs)%20av%2073ff0ea2d4694e4fa7d1d52422c17b93.html), Justification des choix technologiques (équipements réseau, routage, switching, etc.). (Projet%20ganzou%2017c94c02d31e80c09164c36db48f4704/Tasks%2017c94c02d31e81ac96e3f2c7502015ad/Justification%20des%20choix%20technologiques%20(e%CC%81quipemen%2008a30d68282a4ff3ba6a5313a5795ea5.html), Configurations des routeurs, switches et pare-feux. Documentation de l'implémentation (extraits de config, etc.). (Projet%20ganzou%2017c94c02d31e80c09164c36db48f4704/Tasks%2017c94c02d31e81ac96e3f2c7502015ad/Configurations%20des%20routeurs,%20switches%20et%20pare-feux%206ac6c4632cb64de095361bb5917128e5.html), Stratégie de gestion des firmwares et des mises à jour pour sécuriser les équipements. (Projet%20ganzou%2017c94c02d31e80c09164c36db48f4704/Tasks%2017c94c02d31e81ac96e3f2c7502015ad/Strate%CC%81gie%20de%20gestion%20des%20firmwares%20et%20des%20mises%20a%205c836e7ce35749c281a4fca820450ad3.html), Déploiement de solutions IDS/IPS, pare-feu, segmentation Zero Trust, gestion des accès par rôle. (Projet%20ganzou%2017c94c02d31e80c09164c36db48f4704/Tasks%2017c94c02d31e81ac96e3f2c7502015ad/De%CC%81ploiement%20de%20solutions%20IDS%20IPS,%20pare-feu,%20segme%20deaadb0993114438b806e555e37d777e.html), Mise en place d’un réseau Zero Trust avec justification des outils (Palo Alto, Zscaler, etc.). (Projet%20ganzou%2017c94c02d31e80c09164c36db48f4704/Tasks%2017c94c02d31e81ac96e3f2c7502015ad/Mise%20en%20place%20d%E2%80%99un%20re%CC%81seau%20Zero%20Trust%20avec%20justifi%20754ddb7a3fec4f3e86c03e79e53c0c10.html), Documentation des procédures en cas d'incident réseau ou d'intrusion (PRA/PCA). (Projet%20ganzou%2017c94c02d31e80c09164c36db48f4704/Tasks%2017c94c02d31e81ac96e3f2c7502015ad/Documentation%20des%20proce%CC%81dures%20en%20cas%20d'incident%20re%209a560a72b9c34460ae42796ad6066501.html), Stratégie de réponse en cas de panne majeure et plan de reprise d’activité (inclus backup réseau). (Projet%20ganzou%2017c94c02d31e80c09164c36db48f4704/Tasks%2017c94c02d31e81ac96e3f2c7502015ad/Strate%CC%81gie%20de%20re%CC%81ponse%20en%20cas%20de%20panne%20majeure%20et%20%204415e3f9a2ec459f97d2c9fedd8a049a.html), Monitoring proactif avec des outils (PRTG, SolarWinds), intégration d’alertes automatiques. (Projet%20ganzou%2017c94c02d31e80c09164c36db48f4704/Tasks%2017c94c02d31e81ac96e3f2c7502015ad/Monitoring%20proactif%20avec%20des%20outils%20(PRTG,%20SolarWi%20f9787302461d449c9df0f23ca732ed39.html), Documentation des KPIs surveillés : latence, bande passante, utilisation CPU. (Projet%20ganzou%2017c94c02d31e80c09164c36db48f4704/Tasks%2017c94c02d31e81ac96e3f2c7502015ad/Documentation%20des%20KPIs%20surveille%CC%81s%20latence,%20bande%20%209a91b1063e9a40a8b74c4e9b15629fc0.html), Stratégie de validation des performances du réseau : tests de charge, tests d'intrusion. (Projet%20ganzou%2017c94c02d31e80c09164c36db48f4704/Tasks%2017c94c02d31e81ac96e3f2c7502015ad/Strate%CC%81gie%20de%20validation%20des%20performances%20du%20re%CC%81se%2012be8920e4334990818e4f9cec6e6f81.html), Processus d'amélioration continue des performances. (Projet%20ganzou%2017c94c02d31e80c09164c36db48f4704/Tasks%2017c94c02d31e81ac96e3f2c7502015ad/Processus%20d'ame%CC%81lioration%20continue%20des%20performance%207de37020676345c29f04b72cc7f37280.html), Documentation des outils de surveillance des vulnérabilités (Snyk, Checkmarx). (Projet%20ganzou%2017c94c02d31e80c09164c36db48f4704/Tasks%2017c94c02d31e81ac96e3f2c7502015ad/Documentation%20des%20outils%20de%20surveillance%20des%20vulne%20b92dc705fa304a82aff21eaee6bbbd49.html)","February 14, 2025 → May 16, 2025"
Infrastructure informatique,"The project involves integrating with a popular third-party service, focusing on revamping onboarding with an estimated 250 engineering hours. It is currently in progress, scheduled from November 10 to November 18, 2024, and has a priority level of P2. Additional details about the project can be added directly on the page.",,,250,P2,0,Improve customer support,In progress,"Schéma détaillé de l'architecture des serveurs (physiques et virtuels). (Projet%20ganzou%2017c94c02d31e80c09164c36db48f4704/Tasks%2017c94c02d31e81ac96e3f2c7502015ad/Sche%CC%81ma%20de%CC%81taille%CC%81%20de%20l'architecture%20des%20serveurs%20%203a9ed6fb160743208a2199cd8b841233.html), Justification des choix des hyperviseurs (VMware, Hyper-V), gestion des VMs et des ressources. (Projet%20ganzou%2017c94c02d31e80c09164c36db48f4704/Tasks%2017c94c02d31e81ac96e3f2c7502015ad/Justification%20des%20choix%20des%20hyperviseurs%20(VMware,%20%2068e1c5f2ed69490db3b19cbb1356e3b3.html), Documentation sur la gestion des ressources (CPU, RAM, stockage) avec monitoring proactif (Prometheus, Grafana). (Projet%20ganzou%2017c94c02d31e80c09164c36db48f4704/Tasks%2017c94c02d31e81ac96e3f2c7502015ad/Documentation%20sur%20la%20gestion%20des%20ressources%20(CPU,%20%20f3958dbc065d4e51a516646f55740192.html), Mise en place d'une stratégie d’optimisation des performances (scalabilité horizontale/verticale). (Projet%20ganzou%2017c94c02d31e80c09164c36db48f4704/Tasks%2017c94c02d31e81ac96e3f2c7502015ad/Mise%20en%20place%20d'une%20strate%CC%81gie%20d%E2%80%99optimisation%20des%20%20b3cc296d875c46c4b8cd7cabd1c3cdf5.html), Stratégie de gestion des ressources pour éviter la saturation (auto-scaling). (Projet%20ganzou%2017c94c02d31e80c09164c36db48f4704/Tasks%2017c94c02d31e81ac96e3f2c7502015ad/Strate%CC%81gie%20de%20gestion%20des%20ressources%20pour%20e%CC%81viter%20%202f1b304321ac4fa7b5cdbb471c21d8f7.html), Définition des rôles et responsabilités pour la gestion des systèmes, supervision des SLA et indicateurs. (Projet%20ganzou%2017c94c02d31e80c09164c36db48f4704/Tasks%2017c94c02d31e81ac96e3f2c7502015ad/De%CC%81finition%20des%20ro%CC%82les%20et%20responsabilite%CC%81s%20pour%20la%2087ffce1d668841d3ac1644a76971fbfe.html), Mise en place d'une politique d'évolution de l'infrastructure, incluant les mises à jour planifiées. (Projet%20ganzou%2017c94c02d31e80c09164c36db48f4704/Tasks%2017c94c02d31e81ac96e3f2c7502015ad/Mise%20en%20place%20d'une%20politique%20d'e%CC%81volution%20de%20l'in%20483f22cd793e4a83a50f792f22014bbc.html), Mise en place des PRA/PCA pour garantir la continuité de service (Veeam, Commvault). (Projet%20ganzou%2017c94c02d31e80c09164c36db48f4704/Tasks%2017c94c02d31e81ac96e3f2c7502015ad/Mise%20en%20place%20des%20PRA%20PCA%20pour%20garantir%20la%20continu%20b29226b43d3a48e89c8c6d8b17953f65.html), Documentation de la stratégie de sauvegarde et de restauration des données et systèmes critiques. (Projet%20ganzou%2017c94c02d31e80c09164c36db48f4704/Tasks%2017c94c02d31e81ac96e3f2c7502015ad/Documentation%20de%20la%20strate%CC%81gie%20de%20sauvegarde%20et%20de%20ca7eabd4eed14e5c8c4893e6191e8f33.html), Plan de validation des performances sous charge, tests de résilience. (Projet%20ganzou%2017c94c02d31e80c09164c36db48f4704/Tasks%2017c94c02d31e81ac96e3f2c7502015ad/Plan%20de%20validation%20des%20performances%20sous%20charge,%20t%205886ba09093543cd91ea6ecba0840ae8.html), Documentation des résultats des tests de bascule en cas de défaillance. (Projet%20ganzou%2017c94c02d31e80c09164c36db48f4704/Tasks%2017c94c02d31e81ac96e3f2c7502015ad/Documentation%20des%20re%CC%81sultats%20des%20tests%20de%20bascule%20%2060afd38b61c5443895dcc8f6c8a4cf14.html)","February 14, 2025 → May 16, 2025"
Administration des équipements utilisateurs,No content,,,300,P0,0,Improve customer support,In progress,"Stratégie de déploiement des équipements utilisateurs : postes fixes, portables, terminaux mobiles.² (Projet%20ganzou%2017c94c02d31e80c09164c36db48f4704/Tasks%2017c94c02d31e81ac96e3f2c7502015ad/Strate%CC%81gie%20de%20de%CC%81ploiement%20des%20e%CC%81quipements%20utilis%20c9f1f06f7ad94bf782faaa44df7315f7.html), Documentation des politiques d’administration via Active Directory, gestion des droits d'accès (GPO). (Projet%20ganzou%2017c94c02d31e80c09164c36db48f4704/Tasks%2017c94c02d31e81ac96e3f2c7502015ad/Documentation%20des%20politiques%20d%E2%80%99administration%20via%20%2063513e78bba64a1d9b54c59a8d5a42b7.html), Mise en place de solutions de chiffrement (BitLocker, FileVault), protection anti-malware (Endpoint Security). (Projet%20ganzou%2017c94c02d31e80c09164c36db48f4704/Tasks%2017c94c02d31e81ac96e3f2c7502015ad/Mise%20en%20place%20de%20solutions%20de%20chiffrement%20(BitLock%20246783ba3382473aa0395ea51ec619c5.html), Stratégie de gestion des mises à jour de sécurité (PDQ Deploy, Ansible). (Projet%20ganzou%2017c94c02d31e80c09164c36db48f4704/Tasks%2017c94c02d31e81ac96e3f2c7502015ad/Strate%CC%81gie%20de%20gestion%20des%20mises%20a%CC%80%20jour%20de%20se%CC%81curi%20109f8311bed44e5180bcc2cea4207f30.html), Gestion du cycle de vie des équipements (achat, renouvellement, retrait). (Projet%20ganzou%2017c94c02d31e80c09164c36db48f4704/Tasks%2017c94c02d31e81ac96e3f2c7502015ad/Gestion%20du%20cycle%20de%20vie%20des%20e%CC%81quipements%20(achat,%20r%209e9c62389e6e42c1bcc12788de0b1b4e.html), Stratégie de maintenance préventive et corrective, incluant les mises à jour et support technique. (Projet%20ganzou%2017c94c02d31e80c09164c36db48f4704/Tasks%2017c94c02d31e81ac96e3f2c7502015ad/Strate%CC%81gie%20de%20maintenance%20pre%CC%81ventive%20et%20correctiv%20c919d451d4f644668d62fb8689929edb.html), Déploiement de solutions de messagerie collaborative (Microsoft 365, Google Workspace). (Projet%20ganzou%2017c94c02d31e80c09164c36db48f4704/Tasks%2017c94c02d31e81ac96e3f2c7502015ad/De%CC%81ploiement%20de%20solutions%20de%20messagerie%20collaborat%2035089006f44844a88801931090b46d99.html), Stratégie de sécurisation des communications (TLS, S/MIME, gestion des spams). (Projet%20ganzou%2017c94c02d31e80c09164c36db48f4704/Tasks%2017c94c02d31e81ac96e3f2c7502015ad/Strate%CC%81gie%20de%20se%CC%81curisation%20des%20communications%20(TL%20037173e628e64dc8b2b599931b3e6f93.html), Politique de gestion des données sensibles (chiffrement, accès restreint, conformité RGPD). (Projet%20ganzou%2017c94c02d31e80c09164c36db48f4704/Tasks%2017c94c02d31e81ac96e3f2c7502015ad/Politique%20de%20gestion%20des%20donne%CC%81es%20sensibles%20(chiff%2033aafa7809fc4af6be942694c7f2c04c.html), Stratégie de sauvegarde et de restauration des données utilisateurs. (Projet%20ganzou%2017c94c02d31e80c09164c36db48f4704/Tasks%2017c94c02d31e81ac96e3f2c7502015ad/Strate%CC%81gie%20de%20sauvegarde%20et%20de%20restauration%20des%20do%2093b6f6d0809f486ab72b82ecffc03bfc.html), Plan de tests de sécurité pour les terminaux (test des politiques de sécurité, validation des accès). (Projet%20ganzou%2017c94c02d31e80c09164c36db48f4704/Tasks%2017c94c02d31e81ac96e3f2c7502015ad/Plan%20de%20tests%20de%20se%CC%81curite%CC%81%20pour%20les%20terminaux%20(te%203561a167f2274cf0ba11f5549ffbbb31.html), Documentation des résultats des tests et plan d'amélioration continue. (Projet%20ganzou%2017c94c02d31e80c09164c36db48f4704/Tasks%2017c94c02d31e81ac96e3f2c7502015ad/Documentation%20des%20re%CC%81sultats%20des%20tests%20et%20plan%20d'a%20be6bb4c017c043bf93ca5672dbef4f5d.html)","February 14, 2025 → May 16, 2025"
Livrables,,,,,,0,,Not started,"1ER RENDU : RENDEZ-VOUS CLIENT : (Projet%20ganzou%2017c94c02d31e80c09164c36db48f4704/Tasks%2017c94c02d31e81ac96e3f2c7502015ad/1ER%20RENDU%20RENDEZ-VOUS%20CLIENT%207ae9e2434f69440cbd817340207df750.html), 2EME RENDU : PLANIFICATION DU CADRAGE TECHNIQUE ET METHODOLOGIQUE DU PROJET INFORMATIQUE : (Projet%20ganzou%2017c94c02d31e80c09164c36db48f4704/Tasks%2017c94c02d31e81ac96e3f2c7502015ad/2EME%20RENDU%20PLANIFICATION%20DU%20CADRAGE%20TECHNIQUE%20ET%20M%2070ec1d26c38e462eae16598c9f05ec66.html), 3EME RENDU : SOUTENANCE : PRESENTATION DE LA SOLUTION INFORMATIQUE  (Projet%20ganzou%2017c94c02d31e80c09164c36db48f4704/Tasks%2017c94c02d31e81ac96e3f2c7502015ad/3EME%20RENDU%20SOUTENANCE%20PRESENTATION%20DE%20LA%20SOLUTION%20%20c7e13a0b0493434b8d93d17d43dd113d.html), 4EME RENDU : ANALYSE DE LA DYNAMIQUE DU PROJET : INTROSPECTION (Projet%20ganzou%2017c94c02d31e80c09164c36db48f4704/Tasks%2017c94c02d31e81ac96e3f2c7502015ad/4EME%20RENDU%20ANALYSE%20DE%20LA%20DYNAMIQUE%20DU%20PROJET%20INTRO%20eda93b40b0744a11a3696edf0910fec9.html), 5EME RENDU : DOCUMENTATION ARCHITECTURE TECHNIQUE (DAT) (Projet%20ganzou%2017c94c02d31e80c09164c36db48f4704/Tasks%2017c94c02d31e81ac96e3f2c7502015ad/5EME%20RENDU%20DOCUMENTATION%20ARCHITECTURE%20TECHNIQUE%20(D%20d0e50c2376e149409185685f4bbaaa7f.html)",